ID,Title,Author,Year,Format,File
1,3679-11008-1-SM,Heriyanto,2018,pdf,ebook/3679-11008-1-SM.pdf
2,Analisis Bibliometrik Penelitian dengan Tema Digital Archive,Edi Wibowo dkk,2022,pdf,ebook/Analisis Bibliometrik Penelitian dengan Tema Digital Archive.pdf
3,Buku Digital Metode Penelitian Kualitatif Kuantitatif dan Kombinasi,Sena Wahyu P. dkk,2022,pdf,ebook/Buku Digital Metode Penelitian Kualitatif Kuantitatif dan Kombinasi.pdf
4,Desain Interior Perpustakaan Universitas Indonesia dalam Persepsi Pemustaka, Winda Ayu Sakirah Chaniago dkk,2024,pdf,ebook/Winda Ayu Sakirah Chaniago.pdf
5,Pentingnya Pendidikan Pemakai (User Education) di Perpustakaan Perguruan Tinggi,Lailan Azizah Rangkuti,2014,pdf,ebook/Pentingnya Pendidikan Pemakai (User Education) di Perpustakaan Perguruan Tinggi.pdf
6,Menggabungkan Fungsi dan Estetika Pendekatan Desain Interior yang Holistik di Direktorat Perpustakaan UII,Teguh Prasetyo Utomo,2023,pdf,ebook/Menggabungkan Fungsi dan Estetika Pendekatan Desain Interior yang Holistik di Direktorat Perpustakaan UII.pdf
7,persepsi pemustaka pada desain interior,Erika Mondang Septiani dkk,2015,pdf,ebook/persepsi pemustaka pada desain interior.pdf
8,Penerapan Teori Difusi Inovasi Dalam Community Engagement,Eli Jamilah Mihardja dkk,2022,pdf,ebook/Penerapan Teori Difusi Inovasi Dalam Community Engagement.pdf
